{
  "artist": {
    "id": "maroon-5",
    "name": "Maroon 5",
    "aliases": ["Kara's Flowers"],
    "origin": "Los Angeles, California, US",
    "active": "1994-present",
    "genres": ["pop rock", "pop", "funk rock", "dance-pop"],
    "updated": "2026-08-17",
    "scopeNotes": "Year is the year of first commercial release, not the parent album’s release year; the two differ in several cases, for example \"Memories\" was released in 2019 but appeared on Jordi in 2021. Included: every recording released under the Maroon 5 name, covering studio albums, deluxe and territory-specific editions, re-releases, compilations, covers, soundtrack contributions, non-album singles, and charting remix singles. Excluded: live versions of songs already listed; all tracks on Call and Response: The Remix Album (2008); guest features by individual members on other artists’ records. Kara’s Flowers material is kept as a separate era because it predates the Maroon 5 name and the addition of James Valentine, though the core lineup is the same. The one plausible remaining gap is a territory-exclusive bonus track undocumented on Wikipedia; Japanese, Korean, and Australian editions are where those hide."
  },
  "eras": [
    {
      "id": "kara-s-flowers",
      "label": "Kara's Flowers",
      "range": "1994-2000"
    },
    {
      "id": "maroon-5",
      "label": "Maroon 5",
      "range": "2002-present"
    }
  ],
  "albums": [
    {
      "id": "1-22-03-acoustic",
      "title": "1.22.03.Acoustic",
      "type": "live",
      "year": 2004,
      "era": "maroon-5"
    },
    {
      "id": "103-9-wyeg-presents-edgefest-97",
      "title": "103.9 WYEG Presents Edgefest 97",
      "type": "compilation",
      "year": 1997,
      "era": "kara-s-flowers"
    },
    {
      "id": "bbc-radio-1s-live-lounge-2014",
      "title": "BBC Radio 1's Live Lounge 2014",
      "type": "compilation",
      "year": 2014,
      "era": "maroon-5"
    },
    {
      "id": "begin-again-soundtrack",
      "title": "Begin Again (soundtrack)",
      "type": "soundtrack",
      "year": 2014,
      "era": "maroon-5"
    },
    {
      "id": "change-is-now-renewing-americas-promise",
      "title": "Change Is Now: Renewing America's Promise",
      "type": "compilation",
      "year": 2009,
      "era": "maroon-5"
    },
    {
      "id": "chimes-of-freedom",
      "title": "Chimes of Freedom",
      "type": "compilation",
      "year": 2012,
      "era": "maroon-5"
    },
    {
      "id": "different-strokes-by-different-folks",
      "title": "Different Strokes by Different Folks",
      "type": "compilation",
      "year": 2005,
      "era": "maroon-5"
    },
    {
      "id": "four-track-demonstrations",
      "title": "Four-Track Demonstrations",
      "type": "demo",
      "year": null,
      "era": "kara-s-flowers"
    },
    {
      "id": "good-girl-gone-bad-reloaded",
      "title": "Good Girl Gone Bad: Reloaded",
      "type": "reissue",
      "released": "2008-06-02",
      "year": 2008,
      "era": "maroon-5"
    },
    {
      "id": "hands-all-over",
      "title": "Hands All Over",
      "type": "studio",
      "released": "2010-09-21",
      "year": 2010,
      "era": "maroon-5"
    },
    {
      "id": "hands-all-over-deluxe",
      "title": "Hands All Over (Deluxe)",
      "type": "deluxe",
      "released": "2010-09-21",
      "year": 2010,
      "era": "maroon-5"
    },
    {
      "id": "hands-all-over-re-release",
      "title": "Hands All Over (Re-release)",
      "type": "reissue",
      "released": "2011-06-21",
      "year": 2011,
      "era": "maroon-5"
    },
    {
      "id": "hear-you-me-a-tribute-to-mykel-and-carli",
      "title": "Hear You Me: A Tribute to Mykel and Carli",
      "type": "compilation",
      "year": 1998,
      "era": "kara-s-flowers"
    },
    {
      "id": "his-way-our-way",
      "title": "His Way Our Way",
      "type": "compilation",
      "year": 2009,
      "era": "maroon-5"
    },
    {
      "id": "hoot-soundtrack",
      "title": "Hoot (soundtrack)",
      "type": "soundtrack",
      "year": 2006,
      "era": "maroon-5"
    },
    {
      "id": "it-wont-be-soon-before-long",
      "title": "It Won't Be Soon Before Long",
      "type": "studio",
      "released": "2007-05-16",
      "year": 2007,
      "era": "maroon-5"
    },
    {
      "id": "it-wont-be-soon-before-long-deluxe",
      "title": "It Won't Be Soon Before Long (Deluxe)",
      "type": "deluxe",
      "released": "2007-05-16",
      "year": 2007,
      "era": "maroon-5"
    },
    {
      "id": "it-wont-be-soon-before-long-re-release",
      "title": "It Won't Be Soon Before Long (Re-release)",
      "type": "reissue",
      "year": 2008,
      "era": "maroon-5"
    },
    {
      "id": "jordi",
      "title": "Jordi",
      "type": "studio",
      "released": "2021-06-11",
      "year": 2021,
      "era": "maroon-5"
    },
    {
      "id": "jordi-deluxe",
      "title": "Jordi (Deluxe)",
      "type": "deluxe",
      "released": "2021-06-11",
      "year": 2021,
      "era": "maroon-5"
    },
    {
      "id": "live-friday-the-13th",
      "title": "Live: Friday the 13th",
      "type": "live",
      "year": 2005,
      "era": "maroon-5"
    },
    {
      "id": "love-is-like",
      "title": "Love Is Like",
      "type": "studio",
      "released": "2025-08-15",
      "year": 2025,
      "era": "maroon-5"
    },
    {
      "id": "love-is-like-deluxe",
      "title": "Love Is Like (Deluxe)",
      "type": "deluxe",
      "released": "2025-08-15",
      "year": 2025,
      "era": "maroon-5"
    },
    {
      "id": "love-is-like-japan-special-edition",
      "title": "Love Is Like (Japan Special Edition)",
      "type": "deluxe",
      "year": 2025,
      "era": "maroon-5"
    },
    {
      "id": "mary-had-a-little-amp",
      "title": "Mary Had a Little Amp",
      "type": "compilation",
      "year": 2004,
      "era": "maroon-5"
    },
    {
      "id": "nu-king-jason-derulo",
      "title": "Nu King (Jason Derulo)",
      "type": "studio",
      "released": "2025-01-24",
      "year": 2025,
      "era": "maroon-5"
    },
    {
      "id": "overexposed",
      "title": "Overexposed",
      "type": "studio",
      "released": "2012-06-20",
      "year": 2012,
      "era": "maroon-5"
    },
    {
      "id": "overexposed-deluxe",
      "title": "Overexposed (Deluxe)",
      "type": "deluxe",
      "released": "2012-06-20",
      "year": 2012,
      "era": "maroon-5"
    },
    {
      "id": "overexposed-korean-australian-deluxe",
      "title": "Overexposed (Korean/Australian Deluxe)",
      "type": "deluxe",
      "year": 2012,
      "era": "maroon-5"
    },
    {
      "id": "rca-demos",
      "title": "RCA Demos",
      "type": "demo",
      "year": 2000,
      "era": "kara-s-flowers"
    },
    {
      "id": "red-pill-blues",
      "title": "Red Pill Blues",
      "type": "studio",
      "released": "2017-11-03",
      "year": 2017,
      "era": "maroon-5"
    },
    {
      "id": "red-pill-blues-deluxe",
      "title": "Red Pill Blues (Deluxe)",
      "type": "deluxe",
      "released": "2017-11-03",
      "year": 2017,
      "era": "maroon-5"
    },
    {
      "id": "red-pill-blues-deluxe-japanese",
      "title": "Red Pill Blues (Deluxe/Japanese)",
      "type": "deluxe",
      "released": "2017-11-03",
      "year": 2017,
      "era": "maroon-5"
    },
    {
      "id": "red-pill-blues-re-release",
      "title": "Red Pill Blues (Re-release)",
      "type": "reissue",
      "year": 2018,
      "era": "maroon-5"
    },
    {
      "id": "rhythms-del-mundo-cuba",
      "title": "Rhythms del Mundo: Cuba",
      "type": "compilation",
      "released": "2006-11-14",
      "year": 2006,
      "era": "maroon-5"
    },
    {
      "id": "room-222-demos",
      "title": "Room #222 Demos",
      "type": "demo",
      "year": null,
      "era": "kara-s-flowers"
    },
    {
      "id": "she-will-be-loved-australian-cd-single-b-side",
      "title": "\"She Will Be Loved\" Australian CD single B-side",
      "type": "single",
      "year": 2004,
      "era": "maroon-5"
    },
    {
      "id": "songs-about-jane",
      "title": "Songs About Jane",
      "type": "studio",
      "released": "2002-06-25",
      "year": 2002,
      "era": "maroon-5"
    },
    {
      "id": "songs-about-jane-10th-anniversary-edition",
      "title": "Songs About Jane: 10th Anniversary Edition",
      "type": "reissue",
      "year": 2012,
      "era": "maroon-5"
    },
    {
      "id": "songs-about-jane-special-repackage",
      "title": "Songs About Jane (Special Repackage)",
      "type": "reissue",
      "year": 2004,
      "era": "maroon-5"
    },
    {
      "id": "spider-man-2-soundtrack",
      "title": "Spider-Man 2 (soundtrack)",
      "type": "soundtrack",
      "year": 2004,
      "era": "maroon-5"
    },
    {
      "id": "stagg-street-recordings",
      "title": "Stagg Street Recordings",
      "type": "demo",
      "year": 1999,
      "era": "kara-s-flowers"
    },
    {
      "id": "the-b-side-collection",
      "title": "The B-Side Collection",
      "type": "compilation",
      "released": "2007-12-18",
      "year": 2007,
      "era": "maroon-5"
    },
    {
      "id": "the-fourth-world",
      "title": "The Fourth World",
      "type": "studio",
      "released": "1997-08-19",
      "year": 1997,
      "era": "kara-s-flowers"
    },
    {
      "id": "the-fourth-world-b-sides",
      "title": "The Fourth World B-sides",
      "type": "compilation",
      "year": 1997,
      "era": "kara-s-flowers"
    },
    {
      "id": "the-hunger-games-songs-from-district-12-and-beyond",
      "title": "The Hunger Games: Songs from District 12 and Beyond",
      "type": "soundtrack",
      "year": 2012,
      "era": "maroon-5"
    },
    {
      "id": "v",
      "title": "V",
      "type": "studio",
      "released": "2014-08-29",
      "year": 2014,
      "era": "maroon-5"
    },
    {
      "id": "v-deluxe",
      "title": "V (Deluxe)",